{
  "schema_version": 1,
  "capability_id": "capability://leanctx/tool-output-optimizer",
  "provider": "leanctx",
  "kind": "tool",
  "version": "1.0.0",
  "surfaces": [
    "mcp"
  ],
  "support_matrix": {
    "mcp": {
      "supported": true
    }
  },
  "local": true,
  "remote": false,
  "reversibility": "conditional",
  "determinism": "deterministic",
  "data_movement": "local_only",
  "supported_classifications": [
    "Public",
    "Internal"
  ],
  "measurement_support": {
    "latency": true,
    "tokens": true,
    "quality": false
  },
  "conformance_version": 1
}
